{
  "protocol": "a2a",
  "platform": "Anypoint",
  "kind": "agent-specification",
  "connections": [
    {
      "kind": "agent",
      "ref": {
        "groupId": "f8d8c8e8-9f9f-4f4f-8f8f-f8d8c8e8d8f8",
        "assetId": "my-cool-agent",
        "version": "1.0.0"
      }
    },
    {
      "kind": "mcp",
      "ref": {
        "groupId": "f8d8c8e8-9f9f-4f4f-8f8f-f8d8c8e8d8f8",
        "assetId": "downstream-system-api",
        "version": "1.2.3"
      },
      "allowed": ["get_user_details", "update_order_status"]
    },
    {
      "kind": "llm",
      "ref": {
        "groupId": "com.organization.llms",
        "assetId": "enterprise-language-model",
        "version": "2.5-turbo"
      }
    }
  ],
  "provenance": {
    "kind": "exchange-asset",
    "metadata": {
      "assetUrl": "https://www.google.com/search?q=https://anypoint.mulesoft.com/exchange/f8d8c8e8-9f9f-4f4f-8f8f-f8d8c8e8d8f8/my-cool-agent/1.0.0/pages/summary/",
      "publishedDate": "2023-10-27T10:00:00Z"
    }
  }
}
